{
  "model": ".offramp/workspace.json",
  "upToDate": false,
  "source": {
    "kind": "build",
    "path": ".offramp/msbuild.binlog",
    "sha256": null,
    "complog": null
  },
  "solution": "CpmShadowing.slnx",
  "buildSucceeded": true,
  "projects": 3,
  "loc": 18,
  "byFrameworkClass": {
    "dual": 0,
    "framework": 0,
    "modern": 0,
    "standard": 3
  },
  "byKind": {
    "console": 0,
    "library": 3,
    "service": 0,
    "test": 0,
    "unknown": 0,
    "web": 0,
    "winforms": 0,
    "wpf": 0
  },
  "cycles": [],
  "windowsOnlyBuildSteps": [],
  "unrecognized": [],
  "notLoaded": [],
  "partial": [],
  "ledgerSnapshot": ".offramp/ledger/2026-09-25-ea9c2ece.json"
}
